8,USA,Permanent Residence,Application to Register Permanent Residence or Adjust Status,I-485,This form is used by individuals in the United States to apply for lawful permanent resident status.,U.S. Citizenship and Immigration Services,https://www.uscis.gov/sites/default/files/document/forms/i-485.pdf,USA immigration Permanent Residence requirements PDF official,downloads/usa/permanent_residence/i-485.pdf,PDF,validated,2025-07-22 10:55:14.392050,2025-07-22 10:55:14.392050,,0,Pending Review,,,,Individuals applying for adjustment of status to become lawful permanent residents.,Mail to the designated USCIS service center based on the applicant's location.,Varies; typically several months depending on case complexity and service center workload.,"$1,140 for the application; additional fees may apply for biometrics.",English,Current Legal Name,text,The applicant's current legal name without any nicknames.,"Doe, John",Date of Birth,date,Date of birth in the format mm/dd/yyyy.,01/15/1990,Country of Citizenship or Nationality,text,The country where the applicant holds citizenship.,United States,Current U.S. Physical Address,text,The current physical address of the applicant in the U.S.,"123 Main St, Springfield, IL 62704",,,,,,,,,,,,,,,,,,,,,,,,,Passport; Form I-693 (medical examination report),2,53960,i-485.pdf,PDF,1203646,https://res.cloudinary.com/dnvkchfnk/image/upload/v1753181684/immigration_documents/originals/usa/permanent_residence/i-485.pdf
7,USA,Permanent Residence,Application to Register Permanent Residence or Adjust Status,I-485,Form I-485 is used by individuals in the U.S. to apply for lawful permanent resident status.,U.S. Citizenship and Immigration Services (USCIS),https://www.uscis.gov/sites/default/files/document/forms/i-485instr.pdf,USA immigration Permanent Residence requirements PDF official,downloads/usa/permanent_residence/i-485instr.pdf,PDF,validated,2025-07-22 10:54:42.514194,2025-07-22 10:54:42.514194,,0,Pending Review,,,,Individuals physically present in the U.S. seeking to become lawful permanent residents.,Mail,6-12 months,"$1,140 plus biometrics fee",English,Application Type or Filing Category,text,Indicates the immigrant category under which the applicant is filing.,Family-based,Personal Information,text,"Basic information including full name, date of birth, and country of birth.","John Doe, 01/01/1990, USA",Eligibility Confirmation,text,Eligibility questions related to adjustment of status.,Yes,,,,,,,,,,,,,,,,,,,,,,,,,,,,,Current passport; Photograph(s); I-94 Arrival/Departure Record; Evidence of eligibility for adjustment of status,4,149777,i-485instr.pdf,PDF,688883,https://res.cloudinary.com/dnvkchfnk/image/upload/v1753181653/immigration_documents/originals/usa/permanent_residence/i-485instr.pdf
6,USA,Student Visa,Welcome to the United States: A Guide for New Immigrants,M-618,A guide for new immigrants providing essential information about living in the United States.,U.S. Citizenship and Immigration Services (USCIS),https://www.uscis.gov/sites/default/files/document/guides/M-618.pdf,USA immigration Student Visa requirements PDF official,downloads\usa\student_visa\M-618.pdf,PDF,validated_with_warnings,2025-07-22 09:10:58.707883,2025-07-22 09:10:58.707883,Fee amount missing; Processing time not specified; Submission method unclear,3,Pending Review,,,,New immigrants and permanent residents in the United States,,,,English,,,,,,,,,,,,,,,,,,,,,,,,,,,,,,,,,,,,,,,,,,0,162018,M-618.pdf,PDF,3746667,https://res.cloudinary.com/dnvkchfnk/image/upload/v1753175416/immigration_documents/originals/usa/student_visa/M-618.pdf
5,USA,Work Visa,Application for Employment Authorization,I-765,Form I-765 is used by certain foreign nationals in the U.S. to apply for an Employment Authorization Document (EAD).,USCIS,https://www.uscis.gov/sites/default/files/document/forms/i-765instr-feerule.pdf,USA work permit application guide official,downloads\usa\work_visa\i-765instr-feerule.pdf,PDF,validated_with_warnings,2025-07-22 07:50:09.862966,2025-07-22 07:50:09.862966,Fee amount missing; Processing time not specified; Submission method unclear; Unclear eligibility requirements for c8 category applicants regarding timeline,4,Pending Review,,,,Foreign nationals in the U.S. requesting employment authorization.,Mail,Varies,Varies,English,Eligibility Category,text,The category under which the applicant is eligible to work.,(a)(3),,,,,,,,,,,,,,,,,,,,,,,,,,,,,,,,,,,,,"Form I-94, Arrival-Departure Record; Final Notice of Eligibility for Resettlement; Form I-797 Notice; USCIS Asylum approval letter; EOIR IJ's signed order",5,116349,i-765instr-feerule.pdf,PDF,429348,https://res.cloudinary.com/dnvkchfnk/image/upload/v1753170575/immigration_documents/originals/usa/work_visa/i-765instr-feerule.pdf
4,USA,Employment Authorization,Employment Eligibility Verification,I-9,Form I-9 is used to document verification of the identity and employment authorization of each new employee hired in the United States.,US Citizenship and Immigration Services (USCIS),https://www.uscis.gov/sites/default/files/document/forms/i-9instr.pdf,USA work permit application guide official,downloads\usa\work_visa\i-9instr.pdf,PDF,validated,2025-07-22 07:49:27.964816,2025-07-22 07:49:27.964816,,0,Pending Review,,,,Employers and employees in the U.S. responsible for completing employment eligibility verification.,Not submitted to USCIS; retained by employer.,Not applicable as the form is not submitted for processing.,No filing fee associated with Form I-9.,English,Employee Current Legal Name,text,The current legal name of the employee.,John Smith,Employee Current Address,text,The complete address of the employee.,"123 Main St, Anytown, USA",Date of Birth,date,The employee's date of birth.,1990-01-01,Social Security Number,text,The employee's 9-digit Social Security number (voluntary).,123-45-6789,,,,,,,,,,,,,,,,,,,,,,,,,"Acceptable documentation for employment verification (e.g., Passport, Green Card, Driver's License)",1,28696,i-9instr.pdf,PDF,297017,https://res.cloudinary.com/dnvkchfnk/image/upload/v1753170537/immigration_documents/originals/usa/work_visa/i-9instr.pdf
3,USA,Work Visa,Application for Employment Authorization,I-765,This form is used to apply for employment authorization in the United States.,U.S. Citizenship and Immigration Services (USCIS),https://www.uscis.gov/sites/default/files/document/forms/i-765.pdf,USA immigration Work Visa requirements PDF official,downloads\usa\work_visa\i-765.pdf,PDF,validated,2025-07-22 07:48:50.730899,2025-07-22 07:48:50.730899,,0,Pending Review,,,,Individuals seeking employment authorization in the U.S.,"Mail, Online via USCIS website",90 days,$410,English,Family Name,text,Applicant's last name.,Doe,Given Name,text,Applicant's first name.,John,Date of Birth,date,Applicant's date of birth in mm/dd/yyyy format.,01/01/1990,Social Security Number (if known),text,Applicant's Social Security number.,123-45-6789,Alien Registration Number,text,U.S. issued alien registration number.,A-123456789,U.S. Mailing Address,text,The applicant's mailing address in the U.S.,"123 Main St, Apt 4B, New York, NY, 10001",Eligibility Category,text,The eligibility category code for the application.,(c)(3)(C),,,,,,,,,,,,,Previous Employment Authorization Document (if applicable); Proof of citizenship or national status; Form G-28 (if applicable),3,14482,i-765.pdf,PDF,478874,https://res.cloudinary.com/dnvkchfnk/image/upload/v1753170496/immigration_documents/originals/usa/work_visa/i-765.pdf
2,USA,Work Visa,Application for Employment Authorization,I-765,Application for Employment Authorization to request an Employment Authorization Document (EAD),USCIS,https://www.uscis.gov/sites/default/files/document/forms/i-765instr.pdf,USA immigration Work Visa requirements PDF official,downloads\usa\work_visa\i-765instr.pdf,PDF,validated,2025-07-22 07:48:08.079372,2025-07-22 07:48:08.079372,,0,Pending Review,,,,Foreign nationals in the USA seeking employment authorization or EAD,Online or Mail,Varies; consult USCIS for updates,$410,English,Eligibility Category,text,Field to indicate eligibility category for employment authorization,(a)(3),Personal Information,text,Fields for personal and contact information of the applicant,"John Doe, 123 Main St, Anytown, USA",,,,,,,,,,,,,,,,,,,,,,,,,,,,,,,,,Stamped Form I-94; Final Notice of Eligibility for Resettlement; USCIS Asylum approval letter; Order granting asylum; Form I-797 Notice for derivative status,5,95848,i-765instr.pdf,PDF,818021,https://res.cloudinary.com/dnvkchfnk/image/upload/v1753170449/immigration_documents/originals/usa/work_visa/i-765instr.pdf
1,USA,Work Visa,Petition for a Nonimmigrant Worker,I-129,Form used to petition for a nonimmigrant worker in various classifications.,USCIS,https://www.uscis.gov/sites/default/files/document/forms/i-129.pdf,USA immigration Work Visa requirements PDF official,downloads\usa\work_visa\i-129.pdf,PDF,validated,2025-07-22 07:47:21.953677,2025-07-22 07:47:21.953677,,0,Pending Review,,,,Employers filing petitions for nonimmigrant workers.,Mail or online through USCIS designated submission portals.,Varies; typically several months depending on the type of petition and current workload.,$460 application fee; additional fees may apply based on the visa type and processing method.,English,Petitioner Legal Name,text,Name of the individual or organization submitting the petition.,John Doe,Mailing Address,text,Complete mailing address for the petitioner.,"123 Main St, Springfield, IL 62701",Federal Employer Identification Number (FEIN),text,Unique number assigned by the IRS to the employer.,12-3456789,Requested Nonimmigrant Classification,text,The classification symbol being requested for the beneficiary.,H-1B,Requested Action,text,"The action being requested, such as extension of stay or change of employer.",Change of employer,,,,,,,,,,,,,,,,,,,,,"Proof of the beneficiary's qualifications (e.g., degrees, certifications); Job offer letter from the petitioning employer; Evidence of the employer's ability to pay the offered wage; Form G-28, if applicable (Notice of Entry of Appearance as Attorney); Copy of the beneficiary's passport",5,71368,i-129.pdf,PDF,2371823,https://res.cloudinary.com/dnvkchfnk/image/upload/v1753170404/immigration_documents/originals/usa/work_visa/i-129.pdf
